{
  "schemaVersion": 1,
  "issue": 18,
  "recordedDate": "2026-09-01",
  "inventoryReference": "design/controller-bench/acquisition.inventory.json",
  "ownerInventoryStatus": "CONFIRMED_NONE_OWNED",
  "purchaseAuthorization": false,
  "cartAuthorization": false,
  "externalContactAuthorization": false,
  "ownerMeaning": "All listed base electronics and required instruments need to be acquired.",
  "nextAuthorizedPreparation": "Refresh reputable-source stock and all-in pricing, then prepare an owner approval packet without creating a cart or order.",
  "notes": [
    "The earlier 63.54-63.94 USD range excludes the required DMM and current-limited supply and is not the all-in purchase total.",
    "No scope, optional remote-cable ESD, USB-C, PD, Thunderbolt, dock, host computer or product-power hardware is authorized by this response."
  ]
}
